{
  "schemaVersion": "1",
  "id": "TAXKIT-HARNESS-FOUNDATION-2026-07-24",
  "profile": "docs/verification/repository-harness-profile.json",
  "target": {
    "repository": "taxkit",
    "path": ".",
    "revision": "8695c018accf4c4abb7e803c631c5120f90e52b2",
    "branch": "main",
    "upstream": "origin/main",
    "worktreeState": "dirty",
    "observedAt": "2026-07-24T21:22:20Z"
  },
  "lifecyclePhase": "accepted-findings-authorized-for-implementation",
  "acceptedLocalDecisions": [
    "Implement accepted HE-001 through HE-004 in strict HFI-001 through HFI-005 dependency order.",
    "Adopt the complete six-skill canonical baseline with only docs-maintainer and package-structure repository-profile overlays.",
    "Preserve docs-writer as the TaxKit public-copy-only extra and portless as an unchanged developer-tool extra.",
    "Create local task commits only after gates pass; stop before every remote, external, release, provider, recovery, or destructive operation."
  ],
  "externalObservations": [],
  "claimedJobs": [
    "Maintain TaxKit governance from self-contained repository-local skills.",
    "Trace accepted findings into requirements, tasks, implementation, proof, and lifecycle closeout.",
    "Validate the profile, structured audit, canonical skill projection, receipt, and Claude links.",
    "Requalify five retained TaxKit journeys against one immutable migrated candidate."
  ],
  "representativeJourneyIds": [
    "taxkit-calculator-direct",
    "taxkit-sdk-packed",
    "taxkit-http-api",
    "taxkit-docs-runtime",
    "taxkit-release-closure"
  ],
  "acceptedOutcomes": [
    "HE-001 through HE-004 are schema-valid and corrected through the dependency-ordered SPEC.",
    "Repository-local skills, profiles, receipts, links, and governance validation work without global runtime dependencies.",
    "One target-specific epoch is accepted only after focused checks, verification, retained journeys, and fresh review pass."
  ],
  "proofBoundaries": [
    "Repository-local source consistency and deterministic validation.",
    "Local Git identity only after an authorized commit and readback.",
    "Local calculator, packed SDK, HTTP API, docs browser, and report-only release-readiness journeys.",
    "Hosted CI, registry, release, deployment, provider, public-site, and external-consumer actuality remain unproved."
  ],
  "inventoryGroups": [
    {
      "id": "root-guidance-skills",
      "selection": "AGENTS.md, CLAUDE.md, .agents/skills/**, and .claude/skills/**",
      "count": 32,
      "artifact": "docs/documentation-audit/harness-foundation/corpus-inventory.json",
      "status": "accounted"
    },
    {
      "id": "readmes",
      "selection": "Repository-owned README files outside excluded trees",
      "count": 27,
      "artifact": "docs/documentation-audit/harness-foundation/corpus-inventory.json",
      "status": "accounted"
    },
    {
      "id": "docs",
      "selection": "Repository-owned readable docs files at the target",
      "count": 184,
      "artifact": "docs/documentation-audit/harness-foundation/corpus-inventory.json",
      "status": "accounted"
    },
    {
      "id": "manifests-tooling",
      "selection": "Manifests, TypeScript, root tooling configuration, lockfile, and workflow",
      "count": 56,
      "artifact": "docs/documentation-audit/harness-foundation/corpus-inventory.json",
      "status": "accounted"
    },
    {
      "id": "representative-source",
      "selection": "Seven representative source owner groups named by the profile",
      "count": 7,
      "artifact": "docs/documentation-audit/harness-foundation/corpus-inventory.json",
      "status": "accounted"
    }
  ],
  "deepReads": [
    {
      "path": "AGENTS.md",
      "classification": "current",
      "reason": "Repository operating, authority, and docs-maintainer route"
    },
    {
      "path": "docs/README.md",
      "classification": "canonical",
      "reason": "Sole documentation lifecycle and truth-layer router"
    },
    {
      "path": "docs/product-specs/harness-foundation-improvements.md",
      "classification": "affected",
      "reason": "Accepted implementation intent and HE mapping"
    },
    {
      "path": ".agents/skills/docs-maintainer/references/harness/contract-map.md",
      "classification": "contradictory",
      "reason": "Requires local references absent at the target"
    },
    {
      "path": "docs/verification/harness-epochs.md",
      "classification": "historical_evidence",
      "reason": "Owns HGI-206 identity and skill-change invalidation"
    },
    {
      "path": "package.json",
      "classification": "generated_owner",
      "reason": "Root verification graph and focused script owner"
    },
    {
      "path": "docs/verification/critical-journeys.json",
      "classification": "canonical",
      "reason": "Five retained TaxKit journey definitions and oracles"
    }
  ],
  "authority": {
    "inspection": "read_only",
    "localMutation": true,
    "externalAccess": "none",
    "approvalReceipt": "Delegated implementation authority from source thread 019f663b-6195-7130-8d2a-6bf5aaf24a8b on 2026-07-24; local task commits require passing gates and an authority receipt."
  },
  "exclusions": [
    "Dependency, build, cache, binary, vendored, generated-output, and inaccessible trees.",
    "Website design, public copy, navigation, package/app behavior, provider access, and external mutation.",
    "Wholesale repo-structure rendering and work outside HFI-001 through HFI-005."
  ],
  "stopConditions": [
    "Repository evidence cannot resolve conflicting semantic owners.",
    "A requirement proves materially wrong and cannot be corrected within the accepted SPEC.",
    "An operation would cross delegated local-write and local-commit authority.",
    "A task gate, journey, or independent review fails without a safe repository-owned correction."
  ],
  "limitations": [
    "The target worktree is dirty only because the parent thread drafted the SPEC, task list, and index before implementation.",
    "Corpus counts establish accounting, not semantic correctness or external behavior.",
    "The global skill collection is migration evidence only and cannot be a repository runtime dependency."
  ],
  "nonClaims": [
    "No hosted CI, remote Git, registry, release, deployment, provider, production, public-site, or external-consumer state was inspected or changed.",
    "HGI-206 does not qualify the skill state introduced by the three 24 July commits.",
    "This audit does not claim general harness effectiveness outside the final target-specific epoch."
  ]
}
